metric_key,metric_name,metric_label,description,formula,unit
M001,total_revenue,Total Revenue,"รายได้รวมจาก payment ที่ aggregate ต่อ rental แล้ว",SUM(revenue_amount),currency
M002,rental_count,Rental Count,"จำนวนการเช่าภาพยนตร์",SUM(rental_count),count
M003,active_customer_count,Active Customer Count,"จำนวนลูกค้าที่มี rental แบบไม่ซ้ำ",COUNT_DISTINCT(customer_id),count
M004,average_revenue_per_rental,Average Revenue per Rental,"รายได้เฉลี่ยต่อการเช่าหนึ่งครั้ง",M001/M002,currency_per_rental
M005,late_return_rate,Late Return Rate,"สัดส่วนรายการคืนล่าช้าต่อรายการที่คืนแล้ว",late_rental_count/returned_rental_count,ratio
